{"protocolVersion":"1.0","agentId":"11111111-1111-4111-8111-111111111111","agentVersion":"0.2.0","timestamp":"2026-08-11T12:00:00Z","hostname":"agent.test.invalid","os":"linux","architecture":"amd64","status":"ONLINE","runningJobs":0,"availableSlots":2,"capabilitiesHash":"aaaaaaaaaaaaaaaaaaaaaaaaaaaaaaaaaaaaaaaaaaaaaaaaaaaaaaaaaaaaaaaa","healthSummary":{"spoolItems":0}}
